{
  "schema_version": "1.0",
  "document_type": "terms",
  "document_version": "2026-09-20",
  "effective_date": "2026-09-20",
  "last_updated": "2026-09-20",
  "jurisdiction_scope": [
    "Canada",
    "United States",
    "European Union",
    "European Economic Area",
    "United Kingdom",
    "Nigeria"
  ],
  "operator": {
    "legal_name": "ROO Secure IT Solutions",
    "website": "https://www.roosecure.com",
    "contact_email": "privacy@roosecure.com"
  },
  "application": null,
  "title": "ROO Secure IT Solutions — Terms of Service",
  "summary": "General terms for websites, applications, software and services.",
  "sections": [
    {
      "id": "acceptance",
      "heading": "1. Acceptance",
      "body": "By accessing or using a ROO Secure service, you agree to the applicable terms, subject to mandatory rights provided by law."
    },
    {
      "id": "services",
      "heading": "2. Services",
      "body": "ROO Secure provides cybersecurity, DevSecOps, software, consulting, digital products and related services. Specific services may have additional terms, statements of work or product-specific conditions."
    },
    {
      "id": "accounts",
      "heading": "3. Accounts",
      "body": "You are responsible for maintaining appropriate credentials and for activity performed through your account, subject to applicable law and ROO Secure's security responsibilities."
    },
    {
      "id": "payments",
      "heading": "4. Orders and Payments",
      "body": "Prices, taxes, billing intervals, renewal terms and payment methods are presented at the point of purchase or in the applicable agreement. Payment processing may be handled by third-party providers."
    },
    {
      "id": "acceptable",
      "heading": "5. Acceptable Use",
      "body": "You must not use a service to violate law, infringe rights, interfere with systems, introduce malicious code, abuse security controls, or conduct unauthorised security testing against systems you do not own or have permission to test."
    },
    {
      "id": "ip",
      "heading": "6. Intellectual Property",
      "body": "ROO Secure and its licensors retain rights in software, branding, documentation and other materials except where ownership is expressly transferred by written agreement. Customer content remains subject to the applicable agreement."
    },
    {
      "id": "availability",
      "heading": "7. Availability",
      "body": "Services may be changed, suspended or unavailable due to maintenance, security events, infrastructure failures or other circumstances. Service-level commitments apply only where expressly agreed."
    },
    {
      "id": "disclaimer",
      "heading": "8. Disclaimers",
      "body": "Services are provided subject to applicable law and any express contractual warranties. Nothing in these terms excludes a right or remedy that cannot lawfully be excluded."
    },
    {
      "id": "liability",
      "heading": "9. Liability",
      "body": "Any limitation of liability is subject to applicable law and the terms of the relevant order, contract or statement of work."
    },
    {
      "id": "termination",
      "heading": "10. Termination",
      "body": "Accounts or services may be suspended or terminated in accordance with applicable terms, contracts and law."
    },
    {
      "id": "law",
      "heading": "11. Governing Terms",
      "body": "Applicable governing law, venue and dispute provisions depend on the service, customer location and governing agreement. Do not publish a jurisdiction-specific clause without legal review."
    },
    {
      "id": "changes",
      "heading": "12. Changes",
      "body": "Terms may be updated from time to time. Material changes should be communicated as appropriate."
    }
  ],
  "contact": {
    "privacy_email": "privacy@roosecure.com",
    "general_email": "info@roosecure.com",
    "website": "https://www.roosecure.com"
  },
  "legal_review_required": true
}